<?xml version="1.0" encoding="UTF-8"?>
<requete_files xmlns:xsi="http://www.w3.org/2001/XMLSchema-instance" xmlns="http://mistrals.sedoo.fr/extract/requete_files" xsi:schemaLocation="http://mistrals.sedoo.fr/extract/requete_files http://mistrals.sedoo.fr/extract/requete_files.xsd">
<projet>HyMeX</projet>
	<utilisateur>
		<utilisateur_email>guillaume.brissebrat@obs-mip.fr</utilisateur_email>
		<utilisateur_nom>guest</utilisateur_nom>
		<utilisateur_institute></utilisateur_institute>
	</utilisateur>
	<compression>zip</compression>
	<selection>
		<datsId>594</datsId>
		<racine>/export1/mistrals/hymex_data/gts/SYNOP</racine>
		<file>/export1/mistrals/hymex_data/gts/SYNOP/0_Documentation</file>
		<file>/export1/mistrals/hymex_data/gts/SYNOP/2010/05/SYN_100501.asc.gz</file>
	</selection>

</requete_files>